[
  {
    "id": "18-12-2025-booksellers-2",
    "date": "December 18, 2025",
    "date_parsed": "2025-12-18",
    "public": 1,
    "type": "booksellers",
    "description": "Litres, the largest e-book and audiobook platform in Russia, deleted almost 4,500 books over concerns that they might violate the law prohibiting drug propaganda. The removed books accounted for around 0.5% of the platform’s entire catalogue.",
    "location": "",
    "source": "url",
    "url1": "https://t.me/agentstvonews/13181",
    "url2": "",
    "url3": ""
  },
  {
    "id": "18-12-2025-booksellers",
    "date": "December 18, 2025",
    "date_parsed": "2025-12-18",
    "public": 1,
    "type": "booksellers",
    "description": "Following inspections of Chitay-Gorod bookstores in Nalchik, Chita, and Ulyanovsk, police have demanded that <em>The Left Hand of Darkness</em>, a science fiction novel by Ursula K. Le Guin, be removed from the shelves. Although the authorities have not officially explained the reason behind the inspections, they are believed to be linked to the novel’s depiction of characters who can change their biological gender.",
    "location": "",
    "source": "url",
    "url1": "https://www.vedomosti.ru/media/news/2025/12/18/1164558-azbuka-i-chitai-gorod-podtverdili",
    "url2": "",
    "url3": ""
  },
  {
    "id": "10-02-2025-publishers",
    "date": "October 2, 2025",
    "date_parsed": "2025-10-02",
    "public": 1,
    "type": "publishers",
    "description": "Ad Marginem Press, an independent publishing house that focuses on translated non-fiction works in philosophy, anthropology, and cultural theory was fined 800,000 rubles (around $10,000) for publishing and selling the Russian translation of Olivia Laing’s <em>Everybody: A Book about Freedom</em>, which allegedly contains “propaganda of non-traditional sexual relations.” The book has been withdrawn from the market.",
    "location": "",
    "source": "url",
    "url1": "https://t.me/endoflaw/1414",
    "url2": "",
    "url3": ""
  },
  {
    "id": "09-05-2025-books",
    "date": "September 5, 2025",
    "date_parsed": "2025-09-05",
    "public": 1,
    "type": "publishers",
    "description": "The <em>Papercuts</em> newsletter, run by the StraightForward project, reported that Russia’s largest publisher has been using the Chinese-developed Qwen AI to review books intended for publication since August 5, identifying content at risk of violating Russian law. Such content has been described as including “promotion of non-traditional sexual relationships, transgenderism and gender change, narcotic and psychotropic substances, the child-free lifestyle, cruelty and violence, pedophilia, incitement to suicide, pornographic materials, and extremism.” According to Dozhd (Rain) TV, that publisher is Eksmo.",
    "location": "",
    "source": "url",
    "url1": "https://sfpapercuts.substack.com/p/chinese-democracy",
    "url2": "https://t.me/tvrain/93783",
    "url3": ""
  },
  {
    "id": "08-22-2025-scholarship",
    "date": "August 22, 2025",
    "date_parsed": "2025-08-22",
    "public": 1,
    "type": "scholarship",
    "description": "The Tamizdat Project, a nonprofit organization and a scholarship initiative dedicated to documenting and studying literary censorship in the Soviet Union and contemporary Russia, was declared a foreign agent by the Ministry of Justice.",
    "location": "",
    "source": "url",
    "url1": "https://minjust.gov.ru/ru/events/50853/",
    "url2": "",
    "url3": ""
  },
  {
    "id": "07-30-2025-books",
    "date": "July 30, 2025",
    "date_parsed": "2025-07-30",
    "public": 1,
    "type": "books",
    "description": "Alexei Navalny's memoir <em>Patriot</em> was banned as extremist literature.",
    "location": "",
    "source": "url",
    "url1": "https://minjust.gov.ru/ru/extremist-materials",
    "url2": "https://www.rbc.ru/politics/30/07/2025/688a45789a79475edb40f422",
    "url3": ""
  },
  {
    "id": "07-18-2025-booksellers",
    "date": "July 18, 2025",
    "date_parsed": "2025-07-18",
    "public": 1,
    "type": "booksellers",
    "description": "Falanster, an independent bookstore in Moscow, and its founder, Boris Kupriyanov, were fined 800,000 and 100,000 rubles respectively (approximately $10,000 and $1,200) for distributing books and comics allegedly containing “propaganda of non-traditional sexual relations.”",
    "location": "Moscow",
    "source": "url",
    "url1": "https://zona.media/news/2025/07/18/falanster",
    "url2": "",
    "url3": ""
  },
  {
    "id": "05-29-2025-books",
    "date": "May 29, 2025",
    "date_parsed": "2025-05-29",
    "public": 1,
    "type": "books",
    "description": "Samokat, an independent publisher specializing in children's literature, has circulated to bookstores a list of 23 titles that must be returned “in accordance with current legislature.” The list includes books on feminism and those featuring LGBTQ+ characters.  ",
    "location": "",
    "source": "url",
    "url1": "https://t.me/paperpaper_ru/58748",
    "url2": "",
    "url3": ""
  },
  {
    "id": "05-27-2025-books",
    "date": "May 27, 2025",
    "date_parsed": "2025-05-27",
    "public": 1,
    "type": "books",
    "description": "A list of 37 books has been circulated to bookstores, with instructions to either destroy or return them to the publishers. The list includes, for example, <em>Žižek's Jokes</em> by Slavoj Žižek.",
    "location": "",
    "source": "url",
    "url1": "https://t.me/bbcrussian/80816",
    "url2": "",
    "url3": ""
  },
  {
    "id": "05-26-2025-booksellers",
    "date": "May 26, 2025",
    "date_parsed": "2025-05-26",
    "public": 1,
    "type": "booksellers",
    "description": "Falanster, an independent bookstore in Moscow, and its founder, Boris Kupriyanov, were fined 80,000 and 40,000 rubles respectively (approximately $1,000 and $500) for alleged involvement in the activities of <a href = \"#04-14-2025-booksellers\"> an “undesirable” organization</a>. The charges were based on the sale of a used copy of <em>On The Way To Magadan</em>, a book authored by a Belarusian anarchist Ihar Alinevich and published with the support of the Anarchist Black Cross Federation, an organization that provides support to political prisoners and was designated undesirable in Russia in February 2024.",
    "location": "Moscow",
    "source": "url",
    "url1": "https://zona.media/news/2025/05/26/falanster",
    "url2": "https://t.me/mediazona_exclusive/3420",
    "url3": ""
  },
  {
    "id": "05-21-2025-booksellers",
    "date": "May 21, 2025",
    "date_parsed": "2025-05-21",
    "public": 1,
    "type": "booksellers",
    "description": "Following <a href=\"#04-10-2025-booksellers\">an inspection in April</a>, Podpisnye Izdaniya (Subscription Editions), an independent bookstore in St. Petersburg, was fined 800,000 rubles (approximately $10,000) for selling, among others, books by Olivia Laing and Susan Sontag, which allegedly contained “propaganda of non-traditional sexual relations.”",
    "location": "St. Petersburg",
    "source": "url",
    "url1": "https://zona.media/news/2025/05/21/sontag",
    "url2": "",
    "url3": ""
  },
  {
    "id": "05-15-2025-books",
    "date": "May 15, 2025",
    "date_parsed": "2025-05-15",
    "public": 1,
    "type": "books",
    "description": "Eksmo, one of Russia's two largest publishing houses, circulated to bookstores a list of 50 titles to be either destroyed or returned, including the Russian translation of <em>Red Closet: The Hidden History of Gay Oppression</em> in the USSR by historian Rustam Alexander, published by Individuum in 2024.",
    "location": "",
    "source": "url",
    "url1": "https://www.rbc.ru/society/15/05/2025/6825f7629a79470a785d2c81",
    "url2": "",
    "url3": ""
  },
  {
    "id": "05-14-2025-publishers",
    "date": "May 14, 2025",
    "date_parsed": "2025-05-14",
    "public": 1,
    "type": "publishers",
    "description": "Eleven current and former affiliates of Eksmo, one of Russia's two largest publishing houses, and its imprints, Individuum and Popcorn Books, were detained in Moscow for allegedly “recruiting people to join the extremist LGBT movement” by selling books containing “LGBT propaganda.” Three of them, Dmitry Protopopov, Pavel Ivanov, and Artyom Vakhlyaev, have been placed under house arrest for “organising the activities of an extremist organisation” under article 282 of the Russian Criminal Code, an offense punishable by up to 12 years in prison. Around 1,000 copies were seized during the raids.",
    "location": "Moscow",
    "source": "url",
    "url1": "https://ovd.info/express-news/2025/05/15/sud-otpravil-pod-domashniy-arest-sotrudnikov-popcorn-books-i-individuum",
    "url2": "https://www.bbc.com/russian/articles/cgkdjd6jnm7o",
    "url3": ""
  },
  {
    "id": "05-14-2025-booksellers",
    "date": "May 14, 2025",
    "date_parsed": "2025-05-14",
    "public": 1,
    "type": "booksellers",
    "description": "Law enforcement conducted a search at Karta Mira (World Map), an independent bookstore in Novosibirsk.",
    "location": "Novosibirsk",
    "source": "url",
    "url1": "https://t.me/horizontal_russia/46458",
    "url2": "",
    "url3": ""
  },
  {
    "id": "04-21-2025-books",
    "date": "April 21, 2025",
    "date_parsed": "2025-04-21",
    "public": 1,
    "type": "books",
    "description": "Alpina Publishers blacked out several paragraphs, which reportedly discussed same-sex relationships or gender transition, in the Russian translation of <em>How to Be Authentic: Simone de Beauvoir and the Quest for Fulfillment</em> by Skye Cleary.",
    "location": "",
    "source": "url",
    "url1": "https://zona.media/news/2025/04/21/thirst ",
    "url2": "",
    "url3": ""
  },
  {
    "id": "04-14-2025-booksellers",
    "date": "April 14, 2025",
    "date_parsed": "2025-04-14",
    "public": 1,
    "type": "booksellers",
    "description": "Falanster, the oldest independent bookstore in Moscow, and its founder, Boris Kupriyanov, were cited for participating in the activities of an unspecified “undesirable” organization, an administrative offense under Russian law. The court hearing was scheduled for May 26, 2025.",
    "location": "Moscow",
    "source": "url",
    "url1": "https://zona.media/news/2025/04/14/falanster",
    "url2": "",
    "url3": ""
  },
  {
    "id": "04-10-2025-booksellers",
    "date": "April 10, 2025",
    "date_parsed": "2025-04-10",
    "public": 1,
    "type": "booksellers",
    "description": "Law enforcement conducted an inspection of Podpisnie Izdaniya (Subscription Editions), an independent bookstore in St. Petersburg. The bookstore was ordered to remove 48 titles from its shelves, including <em>On Women</em> by Susan Sontag published by Ad Marginem in 2024.",
    "location": "St. Petersburg",
    "source": "url",
    "url1": "https://meduza.io/news/2025/04/10/v-peterburge-siloviki-prishli-s-proverkoy-v-magazin-podpisnye-izdaniya-po-dannym-smi-iz-yaty-knigi-s-priznakami-lgbt-ideologii",
    "url2": "",
    "url3": ""
  },
  {
    "id": "03-27-2025-booksellers",
    "date": "March 27, 2025",
    "date_parsed": "2025-03-27",
    "public": 1,
    "type": "publishers",
    "description": "The publisher Individuum was banned from participating in Non/Fiction, a prominent Moscow-based book fair held from April 10 to 13. ",
    "location": "Moscow",
    "source": "url",
    "url1": "https://meduza.io/news/2025/03/27/izdatelstvu-individuum-otkazali-v-uchastii-v-knizhnoy-yarmarke-non-fiction ",
    "url2": "",
    "url3": ""
  },
  {
    "id": "03-19-2025-booksellers",
    "date": "March 19, 2025",
    "date_parsed": "2025-03-19",
    "public": 1,
    "type": "booksellers",
    "description": "Law enforcement seized books by Hannah Arendt and Walter Benjamin from Katarsis, an independent bookstore in Kaliningrad.\n\n",
    "location": "Kaliningrad",
    "source": "[anonymous source]",
    "url1": "",
    "url2": "",
    "url3": ""
  },
  {
    "id": "03-13-2025-booksellers",
    "date": "March 13, 2025",
    "date_parsed": "2025-03-13",
    "public": 1,
    "type": "booksellers",
    "description": "Law enforcement conducted an inspection of Falanster, one of Moscow’s most well-known independent bookstores. During the inspection, officers seized books by Hannah Arendt, Walter Benjamin, Michel Foucault, and Susan Sontag.",
    "location": "Moscow",
    "source": "url",
    "url1": "https://meduza.io/news/2025/03/14/v-moskve-prokuratura-prishla-s-proverkoy-v-knizhnyy-magazin-falanster",
    "url2": "",
    "url3": ""
  },
  {
    "id": "02-19-2025-books",
    "date": "February 19, 2025",
    "date_parsed": "2025-02-19",
    "public": 1,
    "type": "books",
    "description": "AST, one of Russia's two largest publishing houses, withdrew <em>All the Light We Cannot See</em>, a World War II novel by Anthony Doerr, from the market for mentioning sexual violence committed by the Red Army in Germany. The book had been reported to the authorities by a pro-government Telegram channel.",
    "location": "",
    "source": "url",
    "url1": "https://absatz.media/news/108448-v-rossii-izymut-iz-prodazhi-knigu-v-kotoroj-sovetskie-voiny-vystavleny-nasilnikami",
    "url2": "",
    "url3": ""
  },
  {
    "id": "01-11-2025-books",
    "date": "January 11, 2025",
    "date_parsed": "2025-01-11",
    "public": 1,
    "type": "books",
    "description": "Eksmo, one of Russia's two largest publishing houses, withdrew <em>Irena's Children</em> by Tilar Mazzeo, a biography of a Polish social worker who helped smuggle Jewish children out of the Warsaw Ghetto, from the market. First translated into Russian in 2020 and reprinted in 2024, the book was accused of “spreading false information about the conduct of the USSR during World War II” by a pro-government Telegram channel with 16,000 subscribers. Since 2014, such accusations have been treated as a criminal offense under Russian law.",
    "location": "",
    "source": "url",
    "url1": "https://meduza.io/news/2025/01/11/eksmo-snyalo-s-prodazhi-knigu-deti-ireny-o-spasennyh-vo-vremya-vtoroy-mirovoy-voyny-podrostkah-iz-za-frazy-o-prestupleniyah-sovetskih-soldat",
    "url2": "",
    "url3": ""
  },
  {
    "id": "12-01-2024-publishers",
    "date": "December, 2024",
    "date_parsed": "2024-12-01",
    "public": 1,
    "type": "publishers",
    "description": "The independent publishers Boomkniga and Cherny Kvadrat (Black Square) were banned from participating in Non/Fiction, a prominent Moscow-based book fair held from December 5 to 8. Cherny Kvadrat was banned for exhibiting works by “anti-authoritarian authors”; no reasons were provided to Boomkniga.",
    "location": "Moscow",
    "source": "url",
    "url1": "https://t.me/BlackSquarePublishing/1237",
    "url2": "https://www.facebook.com/boomkniga/posts/pfbid02NiYS4RfVyL28XRDLduDBZGyWTzfAqSkXM8ypKX3qVdrYnMVhbzpJ6ugz3cmmjb8fl",
    "url3": ""
  },
  {
    "id": "11-19-2024-publishers",
    "date": "November 19, 2024",
    "date_parsed": "2024-11-19",
    "public": 1,
    "type": "publishers",
    "description": "The publishers Eksmo and AST, along with the printing house Pareto-Print, were each fined 4 million rubles (approximately $50,000) for “disseminating pornographic content involving minors” <em>Legacy</em>, a novel by Vladimir Sorokin. Earlier that year, <em>Legacy</em> had been <a href = \"#04-22-2024-books\">withdrawn from the market</a> by its publisher.",
    "location": "Moscow",
    "source": "url",
    "url1": "https://www.kommersant.ru/doc/7312091 ",
    "url2": "",
    "url3": ""
  },
  {
    "id": "10-24-2024-books",
    "date": "October 24, 2024",
    "date_parsed": "2024-10-24",
    "public": 1,
    "type": "books",
    "description": "The Russian translation of <em>The Russo-Ukrainian War</em> by Harvard historian Serhii Plokhy was banned as extremist literature. The book was never published in Russia.\n\n",
    "location": "",
    "source": "url",
    "url1": "https://minjust.gov.ru/ru/extremist-materials",
    "url2": "",
    "url3": ""
  },
  {
    "id": "08-31-2024-books",
    "date": "August 31, 2024",
    "date_parsed": "2024-08-31",
    "public": 1,
    "type": "books",
    "description": "Roskomnadzor, the Russian internet censorship agency, requested that Freedom Letters, an independent exile publisher, remove three works from their website: <em>Mouse</em> by Ivan Filippov, a novel set in a post-apocalyptic Moscow; <em>Springfield</em> by Sergey Davydov, a novel about a queer relationship in provincial Russia; and <em>Not the Last Words</em>, a collection of final courtroom speeches by Russian political prisoners.",
    "location": "",
    "source": "url",
    "url1": "https://novayagazeta.eu/articles/2024/08/31/roskomnadzor-potreboval-ot-izdatelstva-freedom-letters-udalit-s-saita-sbornik-poslednikh-rechei-politzakliuchennykh-neposlednie-slova-news",
    "url2": "https://novayagazeta.eu/articles/2024/08/30/roskomnadzor-potreboval-udalit-s-saita-freedom-letters-kvir-roman-springfild-news",
    "url3": ""
  },
  {
    "id": "04-25-2024-books",
    "date": "April 25, 2024",
    "date_parsed": "2024-04-25",
    "public": 1,
    "type": "books",
    "description": "AST, one of Russia's two largest publishing houses, blacked out several pages in the Russian translation of <em>Morire per le idee</em> (To Die for Ideas), a biography of Paolo Pasolini by Roberto Carnero, citing the law on “LGBT propaganda” as the reason.",
    "location": "",
    "source": "url",
    "url1": "https://zona.media/news/2024/04/25/epoha",
    "url2": "",
    "url3": ""
  },
  {
    "id": "04-22-2024-books",
    "date": "April 22, 2024",
    "date_parsed": "2024-04-22",
    "public": 1,
    "type": "books",
    "description": "AST, one of Russia's two largest publishing houses, withdrew five books portraying queer relationships from the market for containing “LGBT propaganda.” These books included <em>Giovanni's Room</em> by James Baldwin (first published in Russian in 2004), <em>A Home at the End of the World</em> by Michael Cunningham (2005), <em>A Little Life</em> by Hanya Yanagihara (2017), <em>The Song of Achilles</em> by Madeline Miller (2020), and <em>Legacy</em> by Vladimir Sorokin (published in 2023). Following AST's lead, Eksmo withdrew <em>Real Life</em> by Brandon Taylor (2021).",
    "location": "",
    "source": "url",
    "url1": "https://daily.afisha.ru/news/86688-ast-prekratilo-prodazhi-romana-sorokina-nasledie/",
    "url2": "https://meduza.io/news/2024/04/23/izdatelstvo-ast-reshilo-prekratit-prodazhi-romana-hani-yanagihary-malenkaya-zhizn",
    "url3": "https://meduza.io/news/2024/04/24/eksmo-reshilo-snyat-s-prodazhi-roman-brendona-teylora-nastoyaschaya-zhizn-izdatelstvo-rekomendovalo-svoim-partneram-utilizirovat-knigu"
  },
  {
    "id": "03-06-2024-publishers",
    "date": "March 6, 2024",
    "date_parsed": "2024-03-06",
    "public": 1,
    "type": "publishers",
    "description": "A book festival organized by Polyandria, an independent publisher specializing in children's and young adult literature, and its imprint NoAge was cancelled in Kaliningrad after pro-government activists accused it of promoting authors from enemy countries.",
    "location": "Kaliningrad",
    "source": "url",
    "url1": "https://www.kommersant.ru/doc/6553279",
    "url2": "",
    "url3": ""
  },
  {
    "id": "12-15-2023-books",
    "date": "December 15, 2023",
    "date_parsed": "2023-12-15",
    "public": 1,
    "type": "books",
    "description": "AST, one of Russia's two largest publishing houses, Chitay-Gorod, the country's largest bookstore chain, and LitRes, a major online bookseller, suspended the printing and sale of all books by Russian writers Boris Akunin and Dmitry Bykov, both of whom have publicly condemned Russia's invasion of Ukraine.",
    "location": "",
    "source": "url",
    "url1": "https://www.themoscowtimes.com/2023/12/15/russian-bookstores-publishing-house-ban-books-by-prominent-writers-over-anti-war-statements-a83440",
    "url2": "",
    "url3": ""
  },
  {
    "id": "02-10-2023-booksellers",
    "date": "February 10, 2023",
    "date_parsed": "2023-02-10",
    "public": 1,
    "type": "booksellers",
    "description": "Text messages sent to customers of Falanster, an independent bookstore in Moscow, mentioning <em>End of Regime</em> by Alexander Baunov, a study of political transitions in Spain, Portugal, and Greece in the late twentieth century, were censored by carriers. The messages were delivered only after the book title was removed.",
    "location": "Moscow",
    "source": "url",
    "url1": "https://meduza.io/en/news/2023/02/10/moscow-bookseller-unable-to-send-customers-sms-about-end-of-regime-alexander-baunov-s-new-book",
    "url2": "",
    "url3": ""
  },
  {
    "id": "01-10-2023-publishers",
    "date": "January 10, 2023",
    "date_parsed": "2023-01-10",
    "public": 1,
    "type": "publishers",
    "description": "Law enforcement initiated an administrative case against the independent publisher Popcorn Books (later that year purchased by Eksmo, one of Russia's two largest publishing houses) for spreading “LGBT propaganda.” In 2021, Popcorn Books published <em>Summer in a Pioneer Tie</em>, a best-selling queer young adult novel, which was used as a pretext for the adoption of the law on “LGBT propaganda” in the summer of 2022.",
    "location": "",
    "source": "url",
    "url1": "https://www.kommersant.ru/doc/5759739",
    "url2": "",
    "url3": ""
  },
  {
    "id": "12-01-2022-books",
    "date": "December, 2022",
    "date_parsed": "2022-12-01",
    "public": 1,
    "type": "books",
    "description": "<em>Summer in a Pioneer Tie</em> by Katerina Silvanova and Elena Malisova, a best-selling queer young adult novel published by Popcorn Books in 2021, along with its sequel <em>What the Swallow is Silent About</em>, were withdrawn from the market by multiple bookstores and online platforms under the law on “LGBT propaganda.”\n",
    "location": "",
    "source": "url",
    "url1": "https://www.svoboda.org/a/ozon-snyal-s-prodazhi-roman-leto-v-pionerskom-galstuke-/32165830.html",
    "url2": "",
    "url3": ""
  },
  {
    "id": "10-28-2022-booksellers",
    "date": "October 28, 2022",
    "date_parsed": "2022-10-28",
    "public": 1,
    "type": "booksellers",
    "description": "Bookmate, an electronic book subscription service, along with its CEO Andrew Baev and Head of Marketing Alexey Dokuchaev, was declared a foreign agent by the Ministry of Justice. At the moment, Dokuchaev was also the CEO of two Bookmate-affiliated publishers: Popcorn Books and Individuum. Both were later purchased by Eksmo, one of Russia’s two largest publishing houses. ",
    "location": "",
    "source": "url",
    "url1": "https://www.rbc.ru/society/28/10/2022/635c19de9a79479fe6e3e260",
    "url2": "",
    "url3": ""
  },
  {
    "id": "11-23-2021-books",
    "date": "November 23, 2021",
    "date_parsed": "2021-11-23",
    "public": 1,
    "type": "books",
    "description": "The Russian translation of <em>A Woman in Berlin</em> by Marta Hillers, published in Russia by Totenburg in 2019, was banned as extremist literature. The diary, first published anonymously in English in 1954 and in 1959 in German, recounts the author’s experiences of sexual abuse by Soviet soldiers. The author's identity was not revealed until 2003, two years after Hillers' death.",
    "location": "",
    "source": "url",
    "url1": "https://minjust.gov.ru/ru/extremist-materials",
    "url2": "",
    "url3": ""
  },
  {
    "id": "11-14-2018-books",
    "date": "November 14, 2018",
    "date_parsed": "2018-11-14",
    "public": 1,
    "type": "books",
    "description": "Customs officers in St. Petersburg opened and seized an Amazon package with the book <em>The Future is History: How Totalitarianism Reclaimed Russia</em> by Masha Gessen, suspecting it might encourage extremism and terrorism. The seizure was justified under regulations of the Eurasian Economic Union, which ban the import of materials “containing information that may harm the political and economic interests of Union members.”",
    "location": "St. Petersburg",
    "source": "url",
    "url1": "https://www.kommersant.ru/doc/3806368",
    "url2": "",
    "url3": ""
  }
]